{
  "_meta": {
    "description": "Scenario/objective card library for the Legion app. Covers the current (post-'2.6 refresh', July 2024 onward) Battle Card system: a 9-card Battle Deck per player (3 Primary Objective, 3 Secondary Objective, 3 Advantage), built collaboratively during Setup's 'Building a Mission' step.",
    "game_formats": {
      "standard-1000": "1000-point standard competitive format.",
      "recon-600": "600-point 'Recon' format -- smaller board, shorter game. Uses its own comparable-but-different card set, not yet catalogued here."
    },
    "game_formats_verified": true,
    "deprecated_system_warning": "IMPORTANT: an older card system (separate Objective / Deployment / Condition cards, 800pt standard / 500pt skirmish format) was replaced by the Primary/Secondary/Advantage system described here as of the Legion 2.6.0 Core Rulebook update (~July 2024). The old cards are explicitly no longer supported for play. If any other file in this project (e.g. docs/ARCHITECTURE.md) still references 800pt/500pt or 'Objective/Deployment/Condition' terminology, that's now confirmed stale and needs fixing -- see docs/TODO.md.",
    "battle_deck_rule": "9 cards per player: 3 Primary Objective + 3 Secondary Objective + 3 Advantage, no duplicates. Corresponding Map cards accompany Primary Objectives.",
    "battle_deck_rule_verified": true,
    "distinct_from_campaigns_feature": "AMG also publishes non-competitive 'Scenario' cards for narrative/thematic play (distinct from competitive Primary/Secondary/Advantage cards) -- these are NOT the same thing as this app's user-defined Campaigns feature, which remains an intentional placeholder per docs/TODO.md and docs/DECISIONS.md. AMG's official narrative Scenario cards are a separate, uncatalogued gap -- see below.",
    "last_reviewed": "2026-08-25",
    "verification_status": "STANDARD PRIMARY OBJECTIVE ROSTER COMPLETE (2026-08-25). All 10 current Standard Primary Objectives are catalogued: the six original 2.6 objectives confirmed by AMG's official updated-card/errata roster plus the four Primary Objectives from Battle Deck Card Pack II (released 2026-03-20). Supply Run was corrected from an unverified Primary seed entry to its current Secondary Objective category. Gameplay/scoring fields were filled only where clean current support was available; Contact, Contact!, Payload, and Cauldron intentionally retain blank gameplay fields pending clean current card transcriptions. Secondary Objectives, Advantages, Recon cards, and official narrative Scenarios remain incomplete and will be expanded in separate passes."
  },
  "primary_objectives": [
    {
      "id": "breakthrough",
      "name": "Breakthrough",
      "category": "primary",
      "game_format": "standard-1000",
      "game_format_verified": true,
      "roster_verified": true,
      "roster_source": "https://cdn.svc.asmodee.net/production-amgcom/uploads/2024/12/SWQ_Errata-Reference-2.6.1-12-1.pdf",
      "map_card": "Breakthrough",
      "deployment_note": "Post-2.6, deployment is built into the objective/map card itself rather than a separate Deployment card category.",
      "points_of_interest": "4 POIs, with 2 in each player's territory.",
      "points_of_interest_verified": true,
      "victory_condition": "Starting in Round 2, during each End Phase, score 1 VP for each of your own POIs that is not contested and 2 VPs for each enemy POI you Secure.",
      "victory_condition_verified": true,
      "notes": "Current 2.6 Objective. Roster/title is official; scoring and POI layout cross-checked against current objective-guide coverage."
    },
    {
      "id": "bunker-assault",
      "name": "Bunker Assault",
      "category": "primary",
      "game_format": "standard-1000",
      "game_format_verified": true,
      "roster_verified": true,
      "roster_source": "https://cdn.svc.asmodee.net/production-amgcom/uploads/2024/12/SWQ_Errata-Reference-2.6.1-12-1.pdf",
      "map_card": "Bunker Assault",
      "deployment_note": "Post-2.6, deployment is built into the objective/map card itself rather than a separate Deployment card category.",
      "points_of_interest": "4 Bunker POIs, 2 associated with each side.",
      "points_of_interest_verified": true,
      "victory_condition": "Starting in Round 2, during each End Phase, score 1 VP for each Bunker POI you Secure. Destroying an enemy Bunker is worth 3 VPs.",
      "victory_condition_verified": true,
      "notes": "Current 2.6 Objective. Enemy Bunkers can be damaged and destroyed through the objective's Special Rules."
    },
    {
      "id": "cauldron",
      "name": "Cauldron",
      "category": "primary",
      "game_format": "standard-1000",
      "game_format_verified": true,
      "roster_verified": true,
      "roster_source": "https://store.asmodee.com/products/star-wars-legion-battle-deck-card-pack-ii",
      "map_card": "Cauldron",
      "deployment_note": "Post-2.6, deployment is built into the objective/map card itself rather than a separate Deployment card category.",
      "points_of_interest": null,
      "points_of_interest_verified": false,
      "victory_condition": null,
      "victory_condition_verified": false,
      "notes": "Added in Battle Deck Card Pack II (2026). Current coverage describes securing Waypoints and a suppression-related special rule; exact card text left blank pending a clean transcription."
    },
    {
      "id": "close-the-pocket",
      "name": "Close the Pocket",
      "category": "primary",
      "game_format": "standard-1000",
      "game_format_verified": true,
      "roster_verified": true,
      "roster_source": "https://cdn.svc.asmodee.net/production-amgcom/uploads/2024/12/SWQ_Errata-Reference-2.6.1-12-1.pdf",
      "map_card": "Close the Pocket",
      "deployment_note": "Post-2.6, deployment is built into the objective/map card itself rather than a separate Deployment card category.",
      "points_of_interest": "3 POIs: 1 central POI and 2 flanking POIs.",
      "points_of_interest_verified": true,
      "victory_condition": "Starting in Round 2, during each End Phase, the central POI is worth 2 VPs when Secured and each flanking POI is worth 1 VP when Secured.",
      "victory_condition_verified": true,
      "notes": "Current 2.6 Objective. Roster/title is official; scoring and POI layout cross-checked against current objective-guide coverage."
    },
    {
      "id": "contact-contact",
      "name": "Contact, Contact!",
      "category": "primary",
      "game_format": "standard-1000",
      "game_format_verified": true,
      "roster_verified": true,
      "roster_source": "https://store.asmodee.com/products/star-wars-legion-battle-deck-card-pack-ii",
      "map_card": "Contact, Contact!",
      "deployment_note": "Post-2.6, deployment is built into the objective/map card itself rather than a separate Deployment card category.",
      "points_of_interest": null,
      "points_of_interest_verified": false,
      "victory_condition": null,
      "victory_condition_verified": false,
      "notes": "Added in Battle Deck Card Pack II (2026). Current coverage describes securing Listening Outposts that provide Precise 1; exact setup/scoring text left blank pending a clean card transcription."
    },
    {
      "id": "intercept-signals",
      "name": "Intercept Signals",
      "category": "primary",
      "game_format": "standard-1000",
      "game_format_verified": true,
      "roster_verified": true,
      "roster_source": "https://cdn.svc.asmodee.net/production-amgcom/uploads/2024/12/SWQ_Errata-Reference-2.6.1-12-1.pdf",
      "map_card": "Intercept Signals",
      "deployment_note": "Post-2.6, deployment is built into the objective/map card itself rather than a separate Deployment card category.",
      "points_of_interest": "4 POIs: 1 in each player's territory and 2 along the midfield line.",
      "points_of_interest_verified": true,
      "victory_condition": "Starting in Round 2, during each End Phase, score 1 VP for each qualifying POI outside your own territory that you Secure, or that is contested by one of your units with an Intel token.",
      "victory_condition_verified": true,
      "notes": "Current 2.6 Objective. Each player designates units that receive Intel tokens during setup."
    },
    {
      "id": "outflank",
      "name": "Outflank",
      "category": "primary",
      "game_format": "standard-1000",
      "game_format_verified": true,
      "roster_verified": true,
      "roster_source": "https://store.asmodee.com/products/star-wars-legion-battle-deck-card-pack-ii",
      "map_card": "Outflank",
      "deployment_note": "Post-2.6, deployment is built into the objective/map card itself rather than a separate Deployment card category.",
      "points_of_interest": "4 POIs: 2 central and 1 on each flank.",
      "points_of_interest_verified": true,
      "victory_condition": "Starting in Round 2, during each End Phase, score 1 VP for each POI you Secure, plus up to 1 bonus VP if at least 2 of your Vanguard units are securing one or more POIs.",
      "victory_condition_verified": true,
      "notes": "Added in Battle Deck Card Pack II (2026). Uses Vanguard units as an additional scoring mechanism."
    },
    {
      "id": "payload",
      "name": "Payload",
      "category": "primary",
      "game_format": "standard-1000",
      "game_format_verified": true,
      "roster_verified": true,
      "roster_source": "https://store.asmodee.com/products/star-wars-legion-battle-deck-card-pack-ii",
      "map_card": "Payload",
      "deployment_note": "Post-2.6, deployment is built into the objective/map card itself rather than a separate Deployment card category.",
      "points_of_interest": null,
      "points_of_interest_verified": false,
      "victory_condition": null,
      "victory_condition_verified": false,